"The  only  defenses  raised  by  the  Appellants  at  the  trial  were  that  the  contents  of  the","",""
"Mortgage Bond were not explained prior to signing and that the statement of account","",""
"was incorrect.","",""
"The","learned  Judge  of  the  Provincial  High  Court  of  the  Western  Province  holden","in"
"Colombo (Commercial High Court) rejected these contentions and entered judgment as","",""
"prayed for in the plaint.","",""
"In  this  appeal,  the  Appellants  seek  to  assail  the  judgment  of  the  learned  Commercial","",""
"High Court Judge on the following three grounds:","",""
