"(giving relief to the employee – Kannaariam Nadarajah), and by its order dated 8th"
"March 2019 ruled that the termination of employment of the employee was unfair"
"and unjustified. The learned President of the Labour Tribunal ordered that (i) the"
"employee (Nadarajah) be reinstated with an appropriate salary adjustment on the"
"assumption  that  employment  was  uninterrupted,  and  (ii)  be  paid  a  sum  of  Rs."
"781,050.00 as back-wages in respect of the loss of fifteen (15) months of wages."
