"","probability or a balance of probability as understood in a civil matter, owing to the gravity"
"","of the matters concerned.10"
"39.","Attempts to poke holes in a complainant’s story, so to speak, as defence counsel attempt"
"","so often in criminal courts, are generally futile if a respondent attorney is still exposed as"
"","negligent  and/or  undutiful  at  the  conclusion  of  proceedings.  The  primary  concern  in"
"","proceedings of this nature is not the sanctity of the complaint itself but the suitability of"
"","a respondent to remain on the Roll of Attorneys-at-Law.11"
