"","officials on behalf of the public authority who had actual or ostensible legal or"
"","administrative authority to make such representation."
"(xii)","A public authority is generally not liable to give effect to unauthorized or"
"","unlawful representations made by its officials. If the claimant either knew or"
"","had reason to believe that the official who had made the representation did"
"","not have authority to make such a representation, or in the circumstances he"
"","ought to have known so, the public body will not be bound by such"
"","representation."
