"been a specific undertaking, directed at a particular individual or group, by which the"
"relevant policy’s continuance had been assured. He held that, a substantial legitimate"
"expectation would arise when an individual or a group who have substantial grounds"
"to expect that the substance of the relevant policy will continue to be in force for their"
"particular benefit: not necessarily forever, but at least for a reasonable period of time, to"
"provide a cushion against the change. In such situation, a change cannot lawfully be"
"made, certainly not made abruptly, unless the authority notifies and consults those who"
"would be adversely affected by such change."
