"plant or the expansion of the generation capacity of its existing plant, as the case may be."
"3) Where a person who is issued with a licence under section 13 of this Act to generate"
"electricity of less than 25MW in capacity, proposes to expand its generation capacity of"
"its generation plant as a consequence of which the generation of electricity would exceed"
"25MW  in capacity, the approval of the Commission under subsection (1) for such"
"proposal shall not be granted, unless such person is a person who is qualified under"
"subsection (1) of section 9 of this Act, to be issued with a generation licence."
