"Therefore, (a) until the exact 50 acre parcel of agricultural land that a person could retain"
"was  determined  in  terms  of  the  Law,  and  (b)  where  an  application  had  been  made  in"
"terms of Section 14, until the process stipulated thereunder was completed, it was not"
"possible to say which exact portion of the excess agricultural land held by an individual"
"would in fact vest in the Commission, despite the law providing that all lands in excess of"
"the ceiling were deemed to vest in the Commission from the date of commencement of"
"the said Law."
