"the  Petitioner-Appellants  and  the  Company","in  so  far  as  paying  bonuses  to  the"
"workmen, were contingent upon the Company achieving the net profit targets. It is",""
"admitted that, by reason of the employees’ contribution, renewed marketing strategies",""
"and  sound  financial  management,  the  3rd  Respondent-Respondent  Company  was",""
"successful in achieving a net profit of 54.9 million by the end of June 2004. Accordingly,",""
"the  employees  were  duly  paid  the  first  and  second  bonuses  in  December  2004,  in",""
"compliance with the terms of the Collective Agreement.",""
