"","trial Judge to direct the jury on the basis that there was a common intention on"
"","the part of all the accused to commit murder.”"
"1
00)","It is based on the application of the maxim res judicata pro veritate accipitur"
"","contained in the Sambasivam case, that Chief Justice Basnayake ruled that it"
"","was not possible to apply the principle of ‘common intention’, and therefore"
"","considered the culpability of the appellant founded upon the principles of"
"individual","criminal 
responsibility.  His  Lordship  held 
in 
favour  of"
"","Ariyawantha, by substituting the verdict of ‘murder’ to ‘voluntarily causing"
"","hurt’, and sentenced the appellant accordingly."
