"","properties  sought  to  be  auctioned  by  the  resolution  (A28(ii))  and  inter  alia"
"","engaging in further activities based on the notices of sale of the properties until"
"","the determination of the interim injunction;"
"-","an interim injunction preventing the Defendant and its agents from selling the"
"","properties  sought  to  be  auctioned  by  the  resolution  (A28(ii))  and  inter  alia"
"","engaging in further activities based on the notices of sale of the properties until"
"","the final determination of the action."
