"claimed damages, if any, arising from his inability to carry out a restaurant. Provision"
"for  the  said  course  of  action  was  available  in  terms  of  Clause  3F(g)  of  P1  which"
"specifically provided the right of either party to claim damages arising from the breach"
"of its provisions by the other party. It is clear from the evidence of the Plaintiff that he"
"was of the misconceived view that he had a lien over the property until the monies"
"expended by him were returned. Furthermore, the Plaintiff did not offer to vacate the"
"said premises even after action was filed in the District Court on 21st August 2000 or"
"even after the end of the lease period."
