"","","The 
learned  Counsel  for  the  Defendants  submitted  that  permission  of  the"
"","","Plaintiff  to  show  the  premises  to  a  third  party  was  required only  because  the"
"","","Plaintiff was in physical possession of the said premises."
"(","3)","The  Plaintiff’s  admission  that  he  had  placed  a  security  watcher  at  the  said"
"","","premises."
"(","4)","Possession of the said premises was handed over to the Defendants in January"
"","","2006 by the Plaintiff himself, which demonstrates that physical possession was"
"","","in fact with the Plaintiff."
