"28","SC/APPEAL/5/2021"
"The District Court has no jurisdiction to recover the tax in default as a",""
"fine under section 43(1) of the VAT Act.",""
"However, for the reasons stated above, the Additional District Judge is",""
"directed to take appropriate steps to recover the tax in default, as set out",""
"in  the  certificate  of  tax  in  default  filed  in  the  District  Court  dated",""
"30.06.2016, through the seizure and sale of the appellant’s property in",""
"terms  of  Section  42(6)  of  the  VAT  Act.  The  Commissioner  General  of",""
"Inland Revenue is also directed to make appropriate applications to the",""
"District Court for the Court to make suitable orders in that regard.",""
"I  shall  place  on  record  the  significance  of  the  arguments  advanced  by",""
"learned  counsel  for  the  appellant  with  commendable  clarity  and  force,",""
"notwithstanding  the  resolute  endeavours  of  learned  Deputy  Solicitor",""
"General in countering them.",""
"Let the parties bear their own costs.",""
