"","past  behavior  and  character,  the  harm  caused  by  the  crime,  and  other  relevant"
"","circumstances."
"[21]","The  legislative  intent  was  to  encourage  the  exercise  of  judicial  discretion  that"
"","balances retribution and rehabilitation. In appropriate circumstances, the Court, if it"
"","is satisfied, for reason to be stated in writing, may proceed to suspend the whole or"
"","part of the sentence."
"[22]","This is to be contrasted with section 303, prior to the amendment where it states;"
