"","A.H.M.D. Nawaz, J (Dissenting)"
"57.","As previously highlighted by me, she also mentioned in her evidence the delivery of"
"","the original title deeds by her brother. I pointed this out as subsequent conduct of the"
"","1st  Defendant,  which 
I 
further  classify  as  an 
implicit  admission  that  she  never"
"","relinquished her beneficial beneficial interest in the property. His explanation that it"
"","was as a result of an ongoing negotiation to sell the land is unworthy of credit as this"
"","was not suggested to any of the witnesses including the Plaintiff."
