"","beneficially,  the  law  presumes  that  he  did  not,  and  a  failure  by  them  to"
"","rebut this presumption leads to a resulting trust.7"
"16.","The crucial question then is whether evidence in this case shows that the transferor"
"","did or did not intend to transfer the beneficial interest in the property, real or personal."
"","Undoubtedly, non-payment of consideration for the transfer will point to the intention"
"","of the transferor but evidence that the transferor did not intend to make a gift of the"
"","property to the transferee will also strengthen the presumption that the transferor did"
"","intend to keep the beneficial interest in himself or herself."
