"prescription,","he  must","commence","his","possession"
"","independent  and  adverse  to  the  licensor  commencing","","",""
"from an overt act.","","","",""
"23. Admittedly, the defendant came into possession of the","","","",""
"","land as a licensee of Poornam. The plaintiff has thereafter","","",""
"","gained  title  from  Poornam.  The  position  taken  by  the","","",""
"","learned Counsel for the defendant is that the defendant","","",""
"","was not a licensee of the plaintiff but of Poornam.","","",""
