"Change in marking scheme from P7 to P13","",""
"5",")","It is admitted that the criteria and the marking scheme that was to be adopted in"
"","","selecting candidates to the said post have been set out in P7. The Petitioner states"
"","","that after the selection of the 6th – 10th Respondents, she made inquiries and found"
"","","that the marking scheme that was followed at the interview was different to that"
"","","set out in P7. The latter marking scheme is found in P13."
"6",")","A comparison of the two marking schemes is set out below:"
