"therefore serves as ‘evidence’, he should have given due regard to the challenge"
"made by the defence counsel to the holding of the identification parade, since the"
"accused had been previously shown to the virtual complainant at the Akmeemana"
"police station. In this regard, learned counsel brought to the attention of this Court"
"the  principles  contained  in  The  Queen  vs.  Sivanathan  [68  NLR  350].  She  also"
"submitted that the prosecution had failed to eliminate or counter the serious doubt"
"that  the  defence  had  raised  regarding  the  reliability  of  the  identification  of  the"
"accused. She also submitted that the learned Magistrate had erred in shifting the"
"burden of proving those suspicious circumstances to the defence."
