"Applicant –","“I  discussed  about  my  salary  in  the  interview.  My  monthly  salary  is"
"","113,000  rupees.  I  have  been  working  in  this  company  more  than  8"
"","months. Company paid that salary for all of those 8 months. Now do"
"","you need to decrease my salary?”"
"E
mployer –","“We will pay you according to the contract, but we think that you are"
"","not qualiﬁed for the work of the water plant project and we have no"
"","other suitable work for you, so you only have to resign and leave.”"
