"lend him the money as evidence, still less as advice, that the lender thinks that"
"the purpose for which the borrower intends to use it is sound.” (emphasis added)"
"For all the foregoing reasons, I hold that the Respondent did not undertake to advise the"
"Appellant  on  the  housing  transaction  or  give  any  warranty  of  title  to  the  demised"
"premises. The claim-in-reconvention must necessarily fail."
"The judgment of the Commercial High Court of the Western Province holden in Colombo"
"dated 08.08. 2012 is affirmed."
"The appeal is dismissed with costs fixed at Rs. 1,00,000/=."
"Appeal dismissed."
