"“Having been apprised of the possibility of an outbreak of violence, and drawing from the"
"immediate  past  experience,  in  particular  having  regard  to  the  propensity  for  violence  to"
"quickly spread across the country, His Excellency the President [who was then the Acting"
"President], declared a State of Emergency on 17th July 2022 with effect from 18th July 2022."
"The reasons for such declaration are contained in the Gazette itself, namely ‘the interest of"
"public security, the protection of public order and the maintenance of supplies and services"
"essential to the life of the community.”"
