"","8","SC/APPEAL/231/2017"
"been obtained, the appellate court is confined to determining the questions","",""
"of law on which such leave was granted.","",""
"Although  those  requisites  must  be  present  in  the  judgment,  it  is  not","",""
"necessary  for  a  judgment  to  set  out  the  points  for  determination,  the","",""
"decision thereon, and the reasons for the decision in that precise sequence","",""
"or under distinct subheadings. What is required is that these three essential","",""
"elements  are  discernible  when  the  judgment  is  read  as  a  whole.  That","",""
"constitutes sufficient compliance with the statutory requirements.","",""
"The structure and style of a judgment may vary, depending inter alia on the","",""
"personal preferences of the judge and the nature and complexity of the case.","",""
"Indeed, the same judge may adopt different formats in different cases, as","",""
"circumstances may warrant. The essence of judicial duty lies in delivering","",""
"reasoned justice. The form or style adopted by the judge is secondary and","",""
"should not detract from that fundamental objective.","",""
"The  principal  submission  of  learned  counsel  for  the  plaintiff-appellant","",""
"before this Court is that the judgment of the District Court ought to be set","",""
"aside on the ground that the learned District Judge failed to answer the 1ˢᵗ","",""
"defendant’s  issues  No.  18  to  23  and  the  additional  issues  raised  by  the","",""
"plaintiff No. 24 to 27.","",""
"These issues were raised on a date subsequent to the framing of issues by","",""
"the plaintiff and the 2ⁿᵈ and 3ʳᵈ defendants. As previously explained, the real","",""
"contest lies between the plaintiff and the 2ⁿᵈ defendant, inasmuch as the 1ˢᵗ","",""
"defendant, in his answer, categorically admitted that Deed P1 was not an","",""
"outright transfer but was executed merely as security for a loan, and further","",""
"stated that he was unaware of the contents of Deed P5.","",""
"In  view  of  the  admitted  facts  contained  in  the  plaintiff’s  police  complaint","",""
"marked P3, the 1ˢᵗ defendant ought not to have raised any issue except issue","",""
"No. 23, which asserts that the plaintiff instituted the action against the 1ˢᵗ","",""
