"Section 334(1) of the Code of Criminal Procedure Act, No. 15 of 1979, as"
"amended, reads as follows:"
"The Court of Appeal on any appeal against conviction on a verdict of a"
"jury shall allow the appeal if it thinks that such verdict should be set"
"aside  on  the  ground  that  it  is  unreasonable  or  cannot  be  supported"
"having regard to the evidence, or that the judgment of the court before"
"which the appellant was convicted should be set aside on the ground"
"of a wrong decision of any question of any law or that on any ground"
