"Police on February 8, 2010, and to the rank of Chief Inspector of Police on February","","","","","","",""
"8, 2020, along with the 1st to 22nd Petitioners.","","","","","","",""
"","On January 8, 2020, the Cabinet of Ministers at the time, after considering Cabinet","","","","","",""
"","Memorandum   No.   20/0076/202/002-1   submitted   by   the   contemporary   Prime","","","","","",""
"Minister, decided","to   appoint","a   Committee","to","submit","a","report","with"
"","recommendations for providing relief","","to   government","and","","semi-government",""
"","employees who had been subjected to political  victimization.","","","","The","three-member",""
"","Committee was initially chaired by Minister Mahinda Yapa Abeywardena and was","","","","","",""
"","later by Minister Gamini Lokuge.","","","","","",""
