"Where an application under subsection (1) [of section 31B] relates-","","",""
"","(a) to any matter which, in the opinion of the tribunal, is similar to","",""
"or","identical  with  a  matter  constituting  or","included","in  an"
"","industrial  dispute 
to  which 
the  employer","to  whom","that"
"","application relates is a party and into which an inquiry under","",""
"","this Act is held, or","",""
"","(b) to any matter the facts affecting which are, in the opinion of the","",""
"","tribunal, facts affecting any proceedings under any other law,","",""
