"","Plan No. 1013 (‘P14’) being prepared for the purpose of the Section 14 transfer, rights in"
"","Mattegoda Mukalana (5A:0R:0P) have to be divided and resolved in a partition case."
"31.","In light of the Jinawathie dicta, this contention of the Appellant could only succeed if the"
"","effect of a Section 14 approval is to restore the status quo ante the vesting of land in the"
"","Land Reforms Commission for the limited purpose of effecting an inter-family transfer."
"32.","Section 14 of the Law provides as follows:"
