"expressed by saying that all power is capable of abuse, and that the power to"
"prevent abuse is the acid test of effective judicial review”. 28"
"Let me now turn to Victor Ivan’s  case. The petitioners in Victor Ivan’s  case, had challenged"
"the appointment of the then Chief Justice made by the President under Article 107(1) of the"
"Constitution, alleging that their Fundamental Rights guaranteed under Articles 12(1) of the"
"Constitution had been infringed by reason of the said appointment. Court in that case heard"
"three petitions together and the Petitioners in all three applications had cited the then Chief"
"Justice  as  the  1st  Respondent  (the  main  Respondent),  and  alleged  that  their  Fundamental"
"Rights guaranteed under Articles 12(1) of the Constitution had been infringed by reason of"
"the appointment of the said 1st Respondent as Chief Justice. Thus, all three Petitioners had"
"mounted a direct challenge to the validity of the appointment of the 1st Respondent as the"
"Chief Justice in all three cases. However, in view of the provisions in then existed Article 35"
"of the Constitution, none of the petitioners had sought to name as respondent, the President"
"who in fact made that appointment; in view of the same Article, none of the petitioners had"
"sought to institute proceedings against the Attorney-General for the purpose of representing"
"and defending the President. Therefore, in all those three cases, the Attorney-General had"
