"iii.","The  Minister  in  charge  of  the  subject  of  justice  shall  forward  the  report  with  his"
"","recommendation to the President."
"The documents tendered by the Attorney General include, the reports tendered by the judges",""
"who  heard  the  case  before  the  High  Court-at-Bar.  It  is  relevant  at  this stage  to  quote the",""
"operative parts of the reports of the two learned High Court Judges, who by majority judgment",""
"convicted the recipient of the pardon. They are as follows,",""
"Conclusion of the report by High Court Judge M. C. B. S. Morais on 04-05-2021.",""
