"Before:                                   Yasantha Kodagoda, PC, J.",""
"Kumudini Wickremasinghe, J.",""
"Arjuna Obeyesekere, J.",""
"C
ounsel:","Mr.  Saliya  Pieris,  President’s  Counsel,  with  Mr.  Anjana"
"","Rathnasiri, and Mr. Sarinda Jayawardena, instructed by Mr."
"","Manjula Balasooriya, for the Petitioners in    SC/FR 286/2024."
"","Mr.  Sanjeewa  Jayawardana,  President’s  Counsel,  with  Mr."
"","Rukshan Senadheera, instructed by Mr. Ashoka Niwunhella,"
"","for the Petitioners in SC/FR 287/2024."
