"been read or given, the petitioner shall be entitled by way of reply to"
"comment upon the respondent’s case."
"According to section 385, when the evidence of the respondent is read or"
"given as set out in section 384, the petitioner is entitled, by way of reply, to"
"comment upon the respondent’s case. To “comment upon” the respondent’s"
"case means that the petitioner has the right to address, critique or respond"
"to the evidence presented by the respondent."
"Section 386 of the Civil Procedure Code reads as follows:"
