"Quintavalle (on behalf of Pro-Life Alliance) [2003] UKHL 138, Lord Bingham"
"The basic task of the court is to ascertain and give effect to the true"
"meaning of what Parliament has said in the enactment to be construed."
"But that is not to say that attention should be confined and a literal"
"interpretation  given  to  the  particular  provisions  which  give  rise  to"
"difficulty. Such an approach not only encourages immense prolixity in"
"drafting, since the draftsman will feel obliged to provide expressly for"
