"","","Russia",""
"06","+8220035315","South Korea","01"
"එසමන් ම සමාහු විසින් භාවිතා කරන ලද අංක WP BCG 2763 දරන  තුරු  ැදි  2019.03.06 වන දින","","",""
"අංක 1197, දළුපිටි   ාර, හුණුපිටි , කැළණි  ලිපින  පිිටි අනු ර සමෝටර් ේ සවත ලබා දී එම  ේ","","",""
"ථානස න් අංක  WP BCQ 0304  හ අංක WP BCY 2183 දරන  ේූටි වර්ෙසේ  තුරු ැදි සදකක් හුවමාරු","","",""
"දනම  ටසත් ලබාසෙන ඇති බවත්, එසල  ලබා ෙන්නා ලද අංක WP BCQ 0304 දරන  තුරු  ැදි","","",""
"2019.04.16 දින කාත්තන්කුඩි තාලංකුො ප්‍රසද්ධශසේ දී පුපුරවා හැර ඇති බවටත් වාර්තා වී ඇත.","","",""
