"","28","SC/CHC/APPEAL/18/2018"
"the  jurisdiction  to  take  cognizance  of  and  punish,  and  on  conviction","",""
"impose a sentence of imprisonment not exceeding five years or a fine","",""
"not  exceeding  five  thousand  rupees  or  both  such  imprisonment  and","",""
"fine.”","",""
"These two provisions impose a limit on the power conferred by stating","",""
"that in respect of the offence of contempt of any other Court, the power","",""
"can  be  exercised  only  if  that  other  Court  has  no  jurisdiction  to  take","",""
"cognizance of such contempt. The Constitution of 1978 conferred this","",""
"power on the Court of Appeal but placed no limitation as in the Courts","",""
"Ordinance and the Administration of Justice Law.","",""
