"19","SC/CHC/APPEAL/18/2018"
"","committed against or in disrespect of the authority of any other court,"
"","and  which  such  court  has  not  jurisdiction  under  section  57  to  take"
"","cognizance of and punish, and on conviction to commit the offender to"
"","jail until he shall have purged his contempt or for such period as to the"
"","court or Judge shall seem meet; and such imprisonment shall be simple"
"","or rigorous as such court or Judge shall direct, and the offender may"
"","in addition thereto or in lieu thereof, in the discretion of such court or"
"","Judge, be sentenced to pay a fine not exceeding five thousand rupees."
