"85. In this regard in Sarjun v. Kamaldeen,37 Sarath N. Silva C.J. opined as follows:"
"“A person freely moving on the road in compliance with the law could be stopped"
"and  made  to  alight  from  the  vehicle  only  on  a  reasonable  suspicion  of  illegal"
"activity. Such suspicion would have to be justified in Court. Superior Officers who"
"do not take precautions to prevent any infringement by their subordinates who"
"are  detailed  for  duty  would  themselves  be  liable  for  the  infringement  of  the"
"freedom of movement…” 38"
