"Samayawardhena, J."
"The plaintiff filed action in the District Court of Colombo on 18.11.2003"
"seeking  declaration  of  title  to  the  premises  No.  420,  Old  Moor  Street,"
"Colombo  12,  ejectment  of  the  defendant  and  those  holding  under  him"
"therefrom, and damages in a sum of Rs. 100,000 from 01.11.2003 until"
"restoration of the plaintiff to vacant possession on the basis, inter alia,"
"that 
the  defendant  sublet 
the  premises 
in  violation  of 
the  Lease"
"Agreement.  The  defendant  filed  answer  denying  subletting  and  sought"
"dismissal of the plaintiff’s action. At the trial, only the plaintiff and the"
"defendant gave evidence. The plaintiff produced documents marked P1-"
"P7 in his evidence. After trial, the District Court dismissed the plaintiff’s"
"action  on  the  basis  that  there  was  no  subletting.  On  appeal,  the  High"
"Court of Civil Appeal of Colombo set aside the judgment of the District"
"Court  on  the  basis  that  the  defendant  has  sublet  the  premises  and"
"entered 
judgment 
for  the  plaintiff  as  prayed 
for 
in  the  plaint.  The"
"defendant  is  now  before  this  Court  against  the  judgment  of  the  High"
"Court.  At  the  hearing,  both  parties  agreed  to  confine  the  scope  of"
"argument to the question as to whether the High Court erred in law in"
