"In this regard I am guided by the judgement of Dumbell v Roberts [1944] 1 All ER at","","","","","","","","",""
"pg. 330, where it was held that no person should be arrested by the police except on","","","","","","","","",""
"grounds  which","in","the","particular","circumstances","of","the","arrest","justify","the"
"entertainment of a reasonable suspicion. And that, English Law has recognized that","","","","","","","","",""
"is  in  the  public  interest  that  sufficient  damages  should  be  awarded  in  instances  of","","","","","","","","",""
"false imprisonment in order to give reality to the protection afforded by the law. The","","","","","","","","",""
"court went on to observe that;","","","","","","","","",""
