"(h)","the share of the estate which each heir is entitled to receive,"
"","if agreed to by the heirs."
"(2) The application shall be supported by sufficient evidence to afford",""
"prima facie proof of the material averments in the petition, and shall",""
"name the next of kin of the deceased as respondents. If the petitioner",""
"has  no  reason  to  suppose  that  his  application  will  be  opposed  by",""
"any person, he shall file with his petition an affidavit to that effect.",""
"(3) The petitioner shall tender with the petition-",""
