"19","SC/APPEAL/137/2019"
"nisi  to  later  make  it  absolute,  issuance  of  order  absolute  in  the  first",""
"instance  etc.  are  inapplicable.  The  parties  have  to  follow  neither  the",""
"summary procedure (as contemplated in chapter 24 of the Civil Procedure",""
"Code) nor strictly the regular procedure (by way of plaint and answer) but",""
"rather  a  special  procedure  in  that  the  application  is  made  by  way  of",""
"petition and affidavit. The Court makes substantive orders in the nature",""
"of order absolute after the inquiry.",""
"For completeness, let me consider what happens:",""
