"misfortune  was  a  relevant","factor","in  deciding  whether  to  grant  the"
"amendment:","",""
"","because to the extent that the First Defendant will suffer prejudice",""
"by 
the  refusal  of","this  amendment,  which","I  accept  is  a  clear"
"","possibility, it seems to me clear also that it is very substantially the",""
"","author  of  that  prejudice. The  reality  is that  nothing  has  changed",""
"","since the original incident and there appears to be nothing that has",""
"","been  discovered now  that  could  not  have  been  discovered three",""
"years ago.","",""
