"44.  Hinduism  strongly  advocates","for  non-violence","(Ahimsa)  as  a  guiding  principle  of"
"","governance. The Mahabharata declares, ""Ahimsa paramo dharmah""—non-violence is the",""
"","highest religious duty. A ruler is expected  not only to refrain from harming others but also",""
"","to actively prevent harm, ensuring that governance  does  not  rely on cruelty, oppression,",""
"","or unnecessary conflict. Even in battle, he is to uphold  honour, treating his enemies with",""
"dignity, offering them paths to redemption.","",""
"","Article 11: Different Thresholds and the Minimum Level of Severity Required",""
