"17.  The Respondents  further submit that all the police officers on duty, including those who"
"had been summoned to restore peace  within the University premises, acted  bona fide in"
"their official capacity to ensure the safety of persons, restore peace, minimise damages to"
"the  students as well as  to  the  public  and  state  property,  with no malicious  intention  or"
"ulterior motives towards any student, including the Petitioners."
"ANALYSIS"
"Article 11 of the Constitution and Its Ambit"
