"5.  Following  the  Applicant-Respondent’s  arrest,  the  police  had  produced him  before  the"
"District  Medico-Legal  Officer  of  Nuwara  Eliya  and  the  Medico-Legal  Examination  Form"
"(MLEF). The record also indicates that he had been charged before the Magistrate’s Court"
"of  Nuwara  Eliya  for  causing  annoyance  under  the  influence  of  liquor  in  terms  of  the"
"Offences Committed under the Influence of Liquor (Special Provisions) Act, No. 41 of 1979,"
"and that he had pleaded guilty on 01st September 2008. As a result, the learned Magistrate"
"had imposed a fine of Rs. 2,500/- against the Applicant-Respondent. However, pursuant"
"to  a  revision application filed by the Applicant-Respondent, the High Court  of Nuwara"
"Eliya had set aside the fine so imposed by the Magistrate’s Court, ordering the Applicant"
"to pay Rs. 1,000/- to a charity organisation along with Rs. 1,500/- state costs instead."
