"Thirdly, Akehurst [supra] is of the view that where an administrative body is empowered"
"to confer an individual benefit which he would not otherwise have possessed, there is an"
"implied discretion to revoke such decisions. However, in exercising such discretion, the"
"public body must carefully weigh the competing interests and revoke the decision only"
"where public interests in favour outweigh the private interests of the beneficiary."
"In Regina v. Metropolitan Police Commissioner, Ex Parte Parker [(1953) 1 WLR 1150]"
"Lord Goddard, CJ held:"
