"In Silva v. Attorney General (60 NLR 145 at 151) Basnayake, C.J. observed as follows:",""
"","“In  the  instant  case,  as  stated  above  the  Public  Service  Commission  was  free  to"
"","revoke its delegation by order published in the Government Gazette by virtue of"
"section  15  of  the","Interpretation  Ordinance  (present  section  18)  although  the"
"","empowering section itself, as in the case of the English Statute referred to in the"
"","case of Huth V. Clark (supra), does not confer a power to revoke a delegation once"
"made.”",""
