"Karunanayake,  MP  had  been  tarnished.  Therefore,  the  Minister  of  Finance  had"
"organised  a  press  conference  to  respond  to  these  allegations.  At  that  press"
"conference held on 11th May 2015, the Petitioner had denied the allegations made"
"by the former President and had explained how under the previous administration"
"the non-performing loans profile remained very high. He had also explained what"
"remedial action was being taken to recover the loaned moneys. According to the"
"Petitioner,  the  information  he  had  disclosed  during  the  press  conference  had"
"already been in the public domain."
