"Provisions of the Exchange Control Act, No. 24 of 1953"
"T
here is one other ma(cid:425)er that I must advert to before I conclude."
"T
he learned Counsel for the Respondents submi(cid:425)ed that in terms of the Exchange Control"
"Act, a person who is resident outside Sri Lanka cannot hold shares in a company registered"
"in Sri Lanka except with the permission of the Central Bank. While I shall discuss the said"
"submission in detail later on, I must state at the outset that, (a) R3 – R5 does not reﬂect"
"that this was the reason for the Respondents to have done what they did, and (b) this"
