"compensation is the ""just and equitable"" principle, which is outlined"
"in Section 31C(1). It states:"
"“Where  an  application  under  section  31B  is  made  to  a  labour"
"tribunal,  it  shall  be  the  duty  of  the  tribunal  to  make  all  such"
"inquiries into that application and hear all such evidence as the"
"tribunal  may consider  necessary  and  thereafter  make, not  later"
"than six months from the date of such application, such order as"
"may appear to the tribunal to be just and equitable.”"
