"a  serious  breach  of  trust.  While  the  audit  reports  may  not  have","","","",""
"specifically","indicated","personal","enrichment,","the  Respondent's"
"conduct  demonstrates  dishonest  intent  and  cannot  be  treated  as","","","",""
"mere negligence. It amounts to a willful violation of his duties as a","","","",""
"custodian of company funds.","","","",""
"In this context, the employer's decision to frame  the charge based","","","",""
"on serious financial misconduct was appropriate. The Respondent","","","",""
"was  given  an  opportunity  to  respond  but  failed  to  offer  a  credible","","","",""
"explanation. Therefore, the disciplinary inquiry, although contested,","","","",""
"did not violate principles of fairness or due process.","","","",""
"Accordingly, there is no basis to conclude that the Petitioner engaged","","","",""
"in  any  unfair  labour  practices.  The  dismissal  was  grounded  in","","","",""
"established  misconduct,  and  not  in  any  act  that  prejudiced  the","","","",""
"Respondent’s rights under labour law. Both the Labour Tribunal and","","","",""
"the Provincial High Court failed to properly assess the seriousness","","","",""
"of the misconduct and erred in awarding compensation. The findings","","","",""
"are unsupported by the evidence and inconsistent with principles of","","","",""
"fairness and justice.","","","",""
"In the case of David Micheal Joachim v. Aitken Spence Travels","","","",""
"Ltd [SC Appeal No 09/2010, SC Minutes of 11 th February 2021],","","","",""
"Yasantha Kodagoda, PC, J refers to Chief Justice J.A.N. De Silva in","","","",""
"Kotagala  Plantations  Ltd.  and  Another  v.  Ceylon  Planters","","","",""
"Society [(2010) 2 Sri L.R. 299] held that,","","","",""
