"document not included in the pleadings of that party, and therefore I find that the 1(F)"
"Substituted Defendant’s deeds are not proved."
"In light of these aforementioned facts, I answer the fourth question of law affirmatively."
"As  the  third  and  fourth  questions  of  law  have  been  answered  in  the  affirmative,  it"
"follows that the fifth question of law is also answered in the affirmative."
"In  consideration  of  the  totality  of  the  above  facts  and  submissions,  the  appeal  is"
"allowed with costs."
"Appeal Allowed."
