"“In  order  to  justify  the  reception  of  fresh  evidence  or  a  new  trial  three","","","","","","","","",""
"conditions must be fulfilled:","","","","","","","","",""
"i)  It  must  be  shown  that  the  evidence  could  not  have  been  obtained  with","","","","","","","","",""
"reasonable diligence for use at the trial.","","","","","","","","",""
"ii) Evidence must be such that if given it would probably have an important","","","","","","","","",""
"influence on the result of the case, although it need not be decisive.","","","","","","","","",""
"iii)  The  evidence  must  be  such as is presumable to be believed or in other","","","","","","","","",""
"words","it  must","be","apparently","credible","although","it","need","not","be"
