"","","","S.C. Appeal No. 17/2012","",""
"Court","that","the  Settlement  Order  and","the","three  deeds  of","the  plaintiff  were"
"registered  in  the  same  folio  of  the  Land  Registry.  In  addition,  it was  noted  that","","","","",""
"the  deed  3D4  is  in  effect  a  “  …  transfer  of  the  interest  Gunasekere  was  to  receive”","","","","",""
"under  the  Land  Settlement  Ordinance  and  it  appears  to  the  trial  Court  the","","","","",""
"plaintiff is the “bone fide purchaser for value”.","","","","",""
