"the Supreme Court. The Privy Council, in its judgment of Rajapakse v Fernando","","","","","","",""
"(1920) 21 NLR 495, delivered by Lord Moulton, stated (at p.497);","","","","","","",""
"","“…  by  the  Roman-Dutch  law  as  existing  in  Ceylon,  the  English  doctrine","","","","","",""
"","applies where a grantor has purported to grant an interest in land which he","","","","","",""
"","did  not  at  the  time  possess,  but  subsequently  acquires,  the  benefit  of  his","","","","","",""
"","subsequent  acquisition  goes  automatically  to  the  benefit  of  the  earlier","","","","","",""
"","grantee, or, as it usually expressed “feeds the estoppel”. When, therefore on","","","","","",""
"","the 22nd February 1912, Thomas Carry acquired from the Crown the title to","","","","","",""
"","the  land  which  he  had  conveyed  by  the  deed  of  11th  December  1909,  the","","","","","",""
"benefit  of","that","title  accrues","to","the  grantees  under","that  deed","i.e.,","the"
"","respondent’s predecessor in title.”","","","","","",""
