"representatives,","in  a  manner  that  would  give  rise  to  a  functioning  representative"
"democracy.  That  would  be  by  election  of  representatives  of  the  people  as  head  of  the",""
"executive  (the  President),  and  as  members  of  the  legislature  (Members  of  Parliament),",""
"Provincial  legislatures  (Members  of  Provincial  Councils)  and  as  members  of  Local",""
"Authorities, who shall serve the nation for the good of the public, in terms of the mandate",""
"they  have  received  from  the  People  and  according  to  law,  that  the  sovereignty  of  the",""
"People can be respected.",""
