"contemporary  language  relating  to  digital  communication  media  (also  referred  to  as",""
"‘social  media’)  such  as  Facebook,","‘sharing’  is  generally  understood  as  a  means  of"
"spreading Facebook content by posting the content posted by another user in your own",""
"Facebook profile. In this matter, no evidence has been placed before this Court that the",""
"virtual petitioner had ‘shared’ any material on Facebook which had been received or seen",""
"by him to others, which fall within the ambit of section 3(1) of the ICCPR Act.",""
