"relevance, which provides that all existing written and unwritten law will be valid and"
"operative notwithstanding any inconsistency with the preceding provisions of Chapter"
"III of the Constitution which contains fundamental rights. Though the Computer Crime"
"Act, No. 24 of 2007  and the ICCPR Act, No. 56 of 2007 were enacted after the  present"
"Constitution came  into operation,  Article 80(3) of the Constitution prevents this Court"
"from  inquiring  into  or  commenting  upon  or  in  any  manner  calling  into  question  the"
"validity of these two Acts on any ground whatsoever. Therefore, it would not be possible"
"for this Court to examine and rule upon whether the prohibitions contained in  section"
"120 of the Penal Code, section 3(1) of the ICCPR Act, and section 6(1) of the Computer"
"Crime  Act  come  within  permissible  restrictions  under  Articles  15(2)  and  15(7)  of  the"
"Constitution. Be that as it may, there is certainly no bar on this Court dealing with and"
"concluding on the manner in which the prohibitions contained in section 120 of the Penal"
"Code, section 3(1) of the ICCPR Act and section 6(1) of the Computer Crime Act were"
"sought to be enforced by the Executive against the virtual petitioner."
