"right.","Upon","that","verdict","plaintiff  was","entitled","to"
"","judgment.”","","","","",""
"In the instant case, the respondent clearly averred his title","","","","","",""
"on  prescription  in  paragraphs  25  and  28.  Based  on  those","","","","","",""
"averments  the  issue  No.25  was  raised  without  objection.","","","","","",""
"Therefore, it is clear that the appellant cannot be taken as","","","","","",""
"a  surprise  that  the  respondent  was  claiming  the  title  on","","","","","",""
"prescription. Hence, the appellant was not at all prejudiced","","","","","",""
