"of equal justice.","",""
"Dicey, asserting equality before the law to be a corollary of the famous doctrine","",""
"of the rule of law, emphasised that it means,","",""
"‘the  supremacy  or  predominance  of","law  as  distinguished","from  mere"
"","arbitrariness (... It means again, equality before the law or equal subjection",""
"","of all classes to the ordinary law of the land administered by the ordinary",""
"","law  courts  (...  It  means  that  in  England  no  man  is  above  the  law  but",""
"","everyman,  whatever  his  rank  or  condition  may  be,  is  subject  to  the",""
"ordinary law of the land.’","",""
