"","","applicable to the Court of Justice in India.”","","","","","",""
"","Thus,  it","","is  my  considered  view  that  the  principle  of","","","","law,  every",""
"procedure","","is  to  be  understood  as  permissible  until","","","","it","is  shown  to  be",""
"prohibited  by  the  law,  is  clearly  not  the  correct  one  to  be  acted  upon  in","","","","","","","",""
"relation","to","the","applications","before","the  Court","of  Appeal.","In","the"
"circumstances, a question necessarily arises as to what then is the principle","","","","","","","",""
"of law on which the Court of Appeal should have acted on in determining","","","","","","","",""
"the vires of the impugned Act?","","","","","","","",""
