"","S.C. Appeal Nos. 85/2021 with 86/2021 and 87/2021"
"are  desirous  of  practicing  or  attempting  or  professing  to  practise  land",""
"surveying  and  made  requests  to  the  Council  for 
issuance  of","Annual"
"Practising  Licences  for  the  year  2012,  during  that  meeting,  as  per","its"
"mandate. Instead, the minutes indicate the issue considered by the Council",""
"was  whether  it  could  grant  Annual  Practising  Licences  to  officers  of  the",""
"SLSS ( Sri Lanka Survey Service).",""
