"S.C. Appeal Nos. 85/2021 with 86/2021 and 87/2021","","","","","","",""
"","remove  some  blemish,  or  effect  some  improvement  in  the  national","","","","","",""
"life.","The","Court's","task,  within","the","permissible","bounds","of"
"","interpretation,  is  to  give  effect  to  Parliament's  purpose.  So,  the","","","","","",""
"","controversial provisions should be read in the context of the statute","","","","","",""
"","as a whole, and the statute as a whole should be read in the historical","","","","","",""
"","context of the situation which led to its enactment”.","","","","","",""
