"his issue was considered in Lanka Orix Leasing Company Limited v Weeratunga [supra],"
"where it was held that:"
"“… the requirement in section 32(1) that an application made thereunder to set aside"
"an arbitral award must be made within sixty days of the receipt of the arbitral award,"
"necessarily  means  that  a  party  who  claims  that  he  did  not  receive  a  copy  of  the"
"arbitral award until he was served with notice of the other party’s application under"
"section 31(1) to enforce the arbitral award, will be entitled to make an application"
"under section 32(1) to set aside the arbitral award within sixty days of being served"
"with notice of the application to enforce the arbitral award."
