"","S.C. Appeal No.168/2018","","","","",""
"murder, and to test  the validity of  the impugned decision of the Court of","","","","","",""
"Appeal","in  affirming","that  conviction,","it","is  necessary  for","this  Court","to"
"consider  the  respective  lines  of  reasoning  adopted  by  the  trial  Court  as","","","","","",""
"well  as  the  appellate  Court,  and  to  test  them  in  the  light  of  applicable","","","","","",""
"principles of law relating to sudden fight.","","","","","",""
