"","S.C. Appeal No.168/2018","",""
"and  proceeded","to  hold","that","the  charge  of  murder  against  him  was"
"established","beyond","reasonable","doubt. 
The 
trial  Court 
particularly"
"considered  the  contention  advanced  by  the  4th  accused,  before  this  Court","","",""
"as  well  as  the  trial  Court,  that  he  was  stabbed  by  the  deceased.  The  trial","","",""
"Court was of the view that if the 4th accused had suffered any serious stab","","",""
"injury  as  he  claims,  there  was  no  reason  for  that  fact  not  to  be  revealed","","",""
"during the investigations. The impartiality of the officers who investigated","","",""
"the incident was never questioned or challenged by any of the accused.","","",""
