"to parliamentary privilege, contempt of court, defamation or incitement to an"
"offence. Article 15(7) further provides that ""the exercise and operation of all"
"the fundamental rights declared and recognised by Articles 12, 13(1), 13(2) and"
"14  shall  be  subject  to  such  restrictions  as  may  be  prescribed  by  law  in  the"
"interests of national security, public order and the protection of public health"
"or morality or for the purpose of the due recognition and respect of the rights"
"and  freedoms  of  others  or  of  meeting  the  just  requirements  of  the  general"
"welfare of a democratic society.”"
