"Cruel, Inhuman or Degrading Treatment or Punishment to which Sri L is a State Party","","",""
"since 1994. Accordingly, Article 1 provides for the definition of Torture as follows:","","",""
"","""…torture  means  any  act  by  which  severe  pain  or  suffering,  whether","",""
"","physical or mental is intentionally inflicted on a person for such purposes","",""
"as  obtaining","from  him  or  a","third  person","information  or  a"
"","confession,  punishing  him  for  an  act  he  or  a  third  person  has","",""
"","committed  or  is  suspected  of  having  committed,  intimidating  or","",""
"","coercing him or a third person, or any reason based on discrimination of","",""
"","any kind, when such pain or suffering is inflicted by or at the instigation","",""
"","of or with the consent or acquiescence of a public official or other person","",""
