"[15. I do state that on the 17th, 18th and 19th of December, 2010, the 4 of us"
"were kept in police custody and tortured in the above manner, and on the evening"
"of the 19.12.2010, we were brought before the Magistrate of Avissawella Court"
"and  we  were  detained for  48 hours.  I  do  also state  that  a  detention  order  had"
"been obtained to detain us.]"
"16. 2010. 12. 19 වන දින සිට නැවතත් 2010. 12. 22 වන දින සවස් වන යතක්"
"අපව මිරිහාන යපාලිසියේ රඳවා තබාෙත් බවත්, අපව රඳවාෙත් කාලය තුළදී බණ්ඩාර,"
"ෛසනායක,  භාතිය  ජයසිංහ  හා  යතන්නයකෝන්  ඇතුළු  නිලධාරීන්  7  යෛයනකු  පමණ"
"වධහිංසා කළ බවත් ප්‍රකාශ කර සිටිමි."
"[I  do  state  that,  from  19.  12.  2010  until  the  evening  of  22.  12.  2010,  we  were"
"detained at the Mirihana police station, and during the time we were detained,"
"we  were  tortured  by  nearly  7  officers  including  Bandara,  Dasanayake,  Bhathia"
"Jayasinghe, and Thennakoon]”"
