"In the instant case, as stated by the 1st, 2nd and 4th Respondents in their joint Statement"
"of Objections dated 06th December 2011, the Petitioner and 3 others were arrested by"
"the 2nd Respondent [para 6] while the Respondents were on police patrol, pursuant to"
"the  investigation  which  commenced  under  the  order  and  instructions  of  the  5th"
"Respondent [para 4]."
"As relayed by the Petitioner, the 1st and 2nd Respondents, while the three-wheeler was"
"in motion, forced themselves into the same three-wheeler in which the Petitioner was"
"travelling compelling the driver to take them to the cemetery, where the first acts of"
"torture were recorded and was continuously questioned and compelled to admit to"
"having committed or been associated with the several thefts in the area, particularly"
"the theft of the house of the 4th Respondent. The law requires police officers to inform"
"a person being arrested of the reason for the arrest with such precision so as to enable"
"the  arrestee  to  offer  an  explanation.  There  is  no  indication  of  such  reasons  being"
"provided to the Petitioner as the three-wheel driver was compelled to drive towards"
"the cemetery."
"For the aforementioned reasons, the Court finds that there has been a violation of the"
"Petitioner’s fundamental rights as guaranteed under Article 13(1)."
"13(2): Subsequent Detention and Production Before Magistrate"
"To  address  the  question  as  to  whether  the  Petitioner  has  been  produced  before  a"
"Magistrate within the legally prescribed time period, it is vital to determine the exact"
"time of arrest. The version of events submitted by the Petitioner and the Respondents"
"greatly differed in this regard."
"Irregularities as to the date of arrest"
"The Petitioner states in his Petition that he was taken to the Dambara Cemetery where"
"the chain of torturous acts began, as narrated by the Petition dated 15th December"
"2010. However, all Respondents, particularly the 1st, 2nd and 4th Respondents by their"
"Statement  of  Objections  and  Written  Submissions  and  the  5th  Respondent  by  his"
"SC (FR) Application No.107/2011               JUDGMENT                                    Page 21 of 60"
