"For the matters considered as above, I  have no reason to disagree with the"
"learned  District  Judge  that  the  defendant  has  failed  to  prove  her  claimed"
"prescriptive  title  as  against  the  proved  title  of  the  plaintiff,  and  thereby,"
"granting reliefs to the plaintiff as sought for in the prayer of the plaint."
"When  the  matter  was  appealed  against  to  the  Provincial  High  Court  of  the"
"Western Province holden in Colombo exercising its civil appellate jurisdiction,"
"it appears that the learned High Court Judges who pronounced the judgment"
"has  considered  matters  that  were  not  in  the  issues  settled  before  the  trial"
"Court."
"The fact whether  the property upon which this action was based  upon is a"
"property  that  required  administration  in  terms  of  section  545  of  the  Civil"
"Procedure Code was never at issue during the trial before the District Court."
"The learned Counsel who represented the defendant, who was the appellant"
"before  the  Provincial  High  Court  of  Western  Province  holden  in  Colombo"
"exercising its civil appellate jurisdiction, has taken up this question for the"
"1st time in his written submissions tendered to the High Court. Therefore, it"
"is  abundantly  clear  that  this  was  a  matter  the  learned  District  Judge  of"
"Colombo  was  never  required  to  address  his  mind  when  pronouncing  his"
"judgement."
"The said section of the Civil Procedure Code as it stood before the section was"
"repealed  by  Civil  Procedure  Code  (Amendment)  Act  No.  11  of  2010  and"
"replaced by a new section, reads as follows;"
