"of the directors of the Company. In the letter dated 6th February 2009 addressed to the Chairman of",""
"the Petitioner Company the 5th Respondent had referred to the above ceiling as follows;",""
"","“We further inform that in terms of item 2 (i) (b) of our letter dated 13th January 2009, you"
"are  required  to","limit  the  current  emoluments/  remunerations  of  every  director  of  your"
"","company who receives emoluments/ remunerations exceeding Rs. 200,000/- per month to a"
"","maximum of Rs. 200,000/- per month until the liquidity position of your company improves"
"to a satisfactory level.”",""
