"So with a boundless heart should one cherish all living beings",""
"-","Karaniya Metta Sutta, Sutta Nipata 143-151"
"The 2nd Petitioner, as the mother of the 1st Petitioner, a minor, had a legitimate expectation",""
"to be afforded access to her child, particularly during a period of custodial detention. It is",""
"evident from the material placed before this Court that such access was denied, causing",""
"her  considerable  emotional  distress.  The  2nd  Petitioner,  having  endured  the  natural",""
"physical and emotional demands of pregnancy and childbirth, was placed in a position",""
"where she was unable to render support or comfort to her minor son during a moment of",""
