"Statutory Right and must be expressly created and granted by statute. It",""
"cannot be implied.” Jameel J. further elaborated at 413:",""
"Article  138","is  an  enabling  provision  which  creates  and  grants"
"","jurisdiction  to  the  Court  of  Appeal  to  hear  appeals  from  Courts  of"
"First","Instance,  Tribunals  and  Other 
Institutions. 
It  defines  and"
"","delineates  the  jurisdiction  of  the  Court  of  Appeal.  It  does  not,  nor"
"","indeed does it seek to, create or grant rights to individuals viz-a-viz"
"","appeals. It only deals with the jurisdiction of the Court of Appeal and"
