"","12","SC/TAB/04/2023"
"lead  to  abuse  of  the  process  of  the  Court,  because  in  terms  of  section","",""
"333(1) of the Code of Criminal Procedure Act, once an appeal is accepted,","",""
"all  further  proceedings  in  such  case  shall  be  stayed  and  the  appeal","",""
"together with the case record and eight copies thereof shall be forwarded","",""
"to the Court of Appeal as quickly as possible.","",""
"Judicature Act","",""
"As the long title of the Judicature Act states, it is “An Act to provide for","",""
"the establishment and constitution of a system of Courts of First Instance","",""
"in  terms  of  Article  105(1)  of  the  Constitution,  to  define  the  jurisdiction  of","",""
"and to regulate the procedure in and before such courts, and to provide for","",""
"matters connected with or incidental to the matters aforesaid.”","",""
"Sections 14, 15, and 16 of the Judicature Act create and confer the right","",""
"of appeal from the judgments and orders of the High Court to the Court","",""
"of Appeal by the accused, the Attorney General, and an aggrieved party.","",""
"These provisions delineate the scope of appellate jurisdiction, ensuring","",""
"that specific parties have a defined avenue to challenge the decisions of","",""
"the High Court.","",""
