"matter  or  proceedings,  whether","civil  or","criminal”.","In","this","regard,"
"Samarakoon C.J. in Wadigamangawa’s case stated at 301:","","","","",""
"","It is to be noted that Article 118 states that “the Supreme Court shall","","","",""
"","be the highest and final superior court of record and shall exercise","","","",""
"","final  appellate  jurisdiction.”  In  my  view,  the  Constitution  intended","","","",""
"","the dichotomy of “civil and criminal jurisdiction” to be exhaustive and","","","",""
"","that between them embraced all proceedings of whatever nature.","","","",""
