"causation","is 
the 
""but-for""","test,  which  requires","that","","the  defendant's"
"negligence be a sine qua non of the harm, a necessary condition without","","","","",""
"which","the  harm  would  not  have","occurred.","In","other  words,","the"
"defendant's negligence is considered a cause of the plaintiff's harm if the","","","","",""
"harm  would  not  have  happened  but  for  the  defendant's  negligence,  as","","","","",""
"established in Cork v. Kirby MacLean Ltd [1952] 2 All ER 402.","","","","",""
