"Lord","Simonds","in  Attorney-General","v.  Prince","Ernest  Augustus","of"
"","Hanover [1957] A.C. 436, 461:","","","",""
"'For words, and particularly general words, cannot be read in isolation:","","","","",""
"their  colour  and  content  are  derived  from  their  context.  So  it  is  that  I","","","","",""
"conceive it to be my right and duty to examine every word of a statute in","","","","",""
"its context, and I use 'context' in  its  widest sense, which I have  already","","","","",""
"indicated  as  including  not  only  other  enacting  provisions  of  the  same","","","","",""
"statute, but its preamble, the existing state of the law, other statutes in","","","","",""
"pari  materia,  and  the  mischief  which  I  can,  by  those  other  legitimate","","","","",""
"means, discern the statute was intended to remedy.'","","","","",""
