"11","SC/APPEAL/11/2021"
"Minister or other promoter of the Bill; and (c) that the statement made in Parliament",""
"is clear and unequivocal. Similar reluctance was shown by judges in Sri Lanka until",""
"the decision of Chief Justice Samarakoon in J.B. Textiles Industries Ltd. v. Minister of",""
"Finance and Planning [1981] 1 Sri LR 156. In Shiyam v. OIC Narcotics Bureau [2006]",""
"2 Sri LR 156, a Full Bench of the Supreme Court held that Hansards could be made",""
"use of to ascertain the intention of the legislature and to interpret a statute which is",""
"ambiguous, obscure or leading to an absurdity. The question before the Full Bench",""
"in Shiyam’s case required the interpretation of section 3(1) of the Bail Act and for",""
"this purpose the Court used the Hansards. Justice Bandaranayake (as Her Ladyship",""
"then was) stated at pages 164-165:",""
