"12","SC/APPEAL/179/2019"
"19(1)  of  the  Marriage  Registration  Ordinance  is  necessary  only  “during",""
"the  lifetime  of  the  parties”.  If  one  party  is  dead,  there  is  no  need  for",""
"dissolution of marriage by an order of Court. Section 108 of the Evidence",""
"Ordinance creates only a presumption of death.",""
"As much as there is a strong affinity between section 107 and 108 of the",""
"Evidence Ordinance, there is a strong affinity between section 108 of the",""
"Evidence Ordinance and the exception to section 362B of the Penal Code.",""
"Section 362B of the Penal Code provides:",""
