"“There are certain tests for ascertaining into which category a case falls. Thus if the","",""
"transferor  continued  to  remain","in  possession  after  the  conveyance,  or","if  the"
"transferor paid the whole cost of the conveyance or if the consideration expressed","",""
"on the deed is utterly inadequate to what would be the fair purchase money for the","",""
"property  conveyed  –  all  these  are  circumstances  which  would  show  whether  the","",""
"transaction was a genuine sale for valuable consideration, or something else.”","",""
