"","aving  considered  the  submissions,  Court  decided  to  grant  Special  Leave  to  Appeal  on  the"
"following questions:",""
"1)","Whether the Court of Appeal has erred by holding at the support stage of the case"
"","itself (without waiting to consider and decide that issue at the end of the argument of"
"","the case) that the land claimed by the Petitioner-Petitioner in this case is a land which"
"","has  not  been  acquired  by  the  State  and  therefore  the  Petitioner-Petitioner  is  not"
"","entitled to maintain this case before the Court of Appeal?"
