"7 Alternatively, the UGC may provide for a central panel of attorneys-at-law from among whom each"
"HEI may seek, pro bono legal assistance in respect of incidents of ragging, as and when necessary, on a"
"case  by  case  basis.  The  HEI  or  the  UGC,  as  the  case  may  be,  may  seek  the  assistance  of  the  Bar"
"Association of Sri Lanka in order to constitute the panel of attorneys-at-law,"
"8 If existing rules and regulations are inadequate to implement this guideline, the HEI should take steps"
"to amend the same or make new rules or regulations."
