"prefer an appeal against the said order and continued to take part in the trial.","","",""
"Section 5 of the Arbitration Act No. 11 of 1995 reads as follows:","","",""
"","“Where a party to an arbitration agreement institutes legal proceedings in a court","",""
"","against  another  party  to  such  agreement  in  respect  of  a  matter  agreed  to  be","",""
"submitted","for  arbitration  under","such  agreement,","the  court  shall  have  no"
"","jurisdiction to hear and determine such matter if the other party objects to the","",""
"","court exercising jurisdiction in respect of such matter” (emphasis added)","",""
