"12","SC/APPEAL/139/2019"
"The learned counsel on behalf of the Accused-Appellants had heavily",""
"relied on a number of decisions handed down by this court as well",""
"as by the Court of Appeal, in support of the proposition that the trial",""
"should  be  declared  a  nullity  in  view  of  the  non-compliance  with",""
"Section 196 of the Code of Criminal Procedure Act. However, I am of",""
"the  view  that  these  decisions  need  to  be  revisited  in  light  of  the",""
"Constitutional provision referred to above.",""
