"22","SC/APPEAL/225/2014"
"the  plaintiff’s  action  was  prescribed.  However,  at  the  hearing  of  the",""
"appeal before the High Court, counsel for the defendants submitted that",""
"the plaintiff’s action was one for “Goods Sold and Delivered” which, by",""
"operation of section 8 of the Prescription Ordinance, was prescribed after",""
"the expiry of one year from the date of the last sale which took place on",""
"30th March 2005 as per the entries in a notebook marked P2. The High",""
"Court  accepted  this  argument  and  dismissed  the  plaintiff’s  action.",""
"Prasanna Jayawardena J. held that the defendant could not have taken",""
"up the defence of prescription for the first time in appeal.",""
