"36.  As  H.N.J.  Perera,  C.J.  opined  in  Sampanthan  and  Others  v.  Attorney-General  and","","","",""
"Others,11","","","",""
"","“…it  must  be  remembered  that  the  President,  who  is  the  Head  of  State  under  the","","",""
"","Constitution, is but a creature of the Constitution. His powers are only those which","","",""
"","are specifically vested in him by the Constitution and the law. Equally, the exercise","","",""
"of","these  powers  by","the  President  are  circumscribed  by","the  provisions  of","the"
"","Constitution and the law...”","","",""
