"Police. Therefore, the Petitioner’s Attorney at Law Ms. Niluka Dissanayake had filed a",""
"Fundamental  Rights  Application  bearing  No.  SC/FR/556/2009  on  behalf  of","the"
"Petitioner, against the 7th Respondent, 2nd Respondent, Commanding Officer of the Sri",""
"Lanka Military Police and several other responsible officers on the alleged infringement",""
"of the violation of the Fundamental Rights of the Petitioner as guaranteed by Articles",""
"11, 12(1), 13(1), 13(2), and 13(3) of the Constitution.",""
