"(2)   Notwithstanding anything to the contrary in any law, a pre-incorporation contract","",""
"","","may be ratified within such period as may be specified in the contract or if no such"
"","","period 
is  specified,  within  a  reasonable  time  after  the 
incorporation  of  such"
"","","company, in the name of which or on behalf of which it has been entered into."
"(","3)","A pre-incorporation contract that is ratified under subsection (2), shall be as valid"
"","","and enforceable as if the company had been a party to the contract at the time it"
"","","was entered into."
