"obtained  money","from  him,","she  does  not","require","the  ownership","certificates."
"Furthermore, she had informed the 2nd Respondent that even if she were to receive","","","","",""
"the certificates, she was duty bound to re-transfer them to the Petitioner. She had also","","","","",""
"requested the 2nd Respondent to transfer the certificates directly to the Petitioner. She","","","","",""
"has drawn the attention of Court to document marked “X15c” and produced by the","","","","",""
"Petitioner,  which  is  a  copy  of  a  letter  dated  20th  June  2016  she  wrote  to  the  2nd","","","","",""
"Respondent,  informing  him  that  the  possession  of  the  premises  in  issue  had  been","","","","",""
"transferred  to  the  Petitioner,  and  therefore  to  treat  the  Petitioner  as  the  lawful","","","","",""
"occupant of the said premises.","","","","",""
