"right,  the  court  will  not  take  the  statute  into  account  unless  it  is"
"specially pleaded by way of defence."
"In Gnananathan v. Premawardena [1999] 3 Sri LR 301, the defence taken"
"in issue Nos. 7-9 was based on section 10 of the Prescription Ordinance."
"These issues on prescription were raised after the commencement of the"
"trial. On appeal, the Court of Appeal took the view that the District Judge"
"should  not  have  accepted  those  issues  as  the  defendant  did  not  plead"
"such a defence in the answer. Justice Weerasekera at 309-310 states:"
