"","16","SC/FR/365/2020"
"he  had  been  severely  assaulted  by  the  police  on  suspicion  of  shop","",""
"burglary. He was not questioned about heroin consumption or addiction","",""
"or possession. The introduction of heroin as a convenient means to justify","",""
"the arrest, assault, and remanding of the petitioner cannot be condoned.","",""
"In  Namasivayam  v.  Gunawardena  [1989]  1  Sri  LR  394  at  401-402,","",""
"Sharvananda C.J. emphasized that “the liberty of an individual which is","",""
"a matter of great constitutional importance should not be interfered with,","",""
"whatever  the  status  of  that  individual  be,  arbitrarily  and  without  legal","",""
"justification.”","",""
"Given the facts and circumstances of this case, I take the view that the","",""
"petitioner had not been arrested according to the procedure established","",""
"by  law.  Hence,  I  hold  that  the  1st  to  3rd  respondents  have  violated  the","",""
"fundamental right of the petitioner guaranteed under Article 13(1) of the","",""
"Constitution.","",""
"Article 11 violation","",""
"Article 5 of the Universal Declaration of  Human Rights adopted by the","",""
"General Assembly of the United Nations in 1948 states:","",""
