"18","SC/FR/365/2020"
"","or for any reason based on discrimination of any kind, when such"
"","pain  or  suffering  is  inflicted  by  or  at  the  instigation  of  or  with  the"
"","consent or acquiescence of a public official or other person acting in"
"","an official capacity. It does not include pain or suffering arising only"
"from, inherent in or incidental to lawful sanctions.",""
"2.  This  article  is  without  prejudice  to  any  international  instrument  or",""
"","national legislation which does or may contain provisions of wider"
"application.",""
