"17.  His Lordship Jayasuriya CJ held,","",""
"","“It is pertinent to observe that the said circular only specifies that a minimum of 8",""
"","years  in  active  service  in  the  rank  of  Inspector  of  Police  and  it  does  not  make  a",""
"","distinction between active service in the regular force and the active service in the",""
"","reserve  force.  It  is  my  view,  acceptance  of  the submission  of  the  Petitioners  would",""
"amount  to","introducing  an  additional  criteria  which  was  not  stipulated","in  the"
"circular.”3","",""
