"ifydaorhdf.a idlaIsh yd ixikaokh lsrsfusos meusKs,sldrshf.a bvus fldgfiys wkkH;djh"
"ms<sn| lreKq uekjska Tmamq lrhs'"
"m
e'2 orK msUqr idod osk 04 lg miq ,shd iy;sl lr we;s me'1 Tmamqfjys"" me'2 orK"
"msUqr ioyka fkdjsfus fya;=j u;u"" meusKs,sldrshf.a kvqj jHdra: fkdfjs' bosrsm;ajs we;s"
"wfkl=;a ilaIs ish,a, i,ld ne,Sfusos me'1 orK Tmamqfjsys jsia;r lr we;af;a me'2 orK"
"m
sUqfra wxl 5 f,i i|yka lr we;s bvus fldgi njg uekjska lreKq Tmamqfjs"
"b
y; i|yka lrekq  wkqj me2 orK msUqfrys wxl 5 f,i olajd we;s bvus fldgi me'1"
"orK  Tmamqfjka  meusKs,sldrshg  whs;s  jq  bvus  fldgi  njg;a""  tu  bvus  fldgig"
"meusKs,sldrshg ks;Hdkql+, whs;shla we;s njg;a wOslrKh ;SrKh lrhs'â€"
