"13. Thereafter, by notice dated 18 June 2015, the District Court directed",""
"","all  stockbrokers,  including  the  LOLC  Securities,  to  furnish  details"
"","pertaining  to  the  share  portfolio  owned  by  the  1st  Defendant.  LOLC"
"Securities,  by","letter  dated  23  June  2015,  responded  by  providing"
"","particulars relating to the shareholdings of the 1st Defendant. However,"
"","it was pointed out by the learned President’s Counsel Nigel Hatch that"
"","the LOLC Securities did not disclose the existence of any purported lien"
"over the share portfolio owned by the 1st Defendant.",""
