"questions of law.",""
"","1.  Could  the  1st  to  3rd  Respondents  succeed  to  the  tenancy  rights  of  Thomas  and"
"","Gimara in terms of the provisions in Section 8(1) of the Agrarian Services Act."
"2.","Is the Judgment of the Court of Appeal contrary to Section 14(1) and (2) of the"
"","Agrarian Services Act read together with Section 4 of the same Act."
"3.","Is there an illegality in the Judgment of the High Court for the Court of Appeal to"
"","set aside the same."
"4.","In the circumstances pleaded, is the Order of the Court of Appeal in terms of law."
