"and  Plantation","Industries  and  Others","[(1985)  1  Sri  LR  285],","it  was  held  by"
"Wanasundera, J that:","","",""
"","“It would however appear that the Cabinet, after due deliberation, has sought to","",""
"","formulate  a  Code  of  regulations  containing  fair  procedures  and  safeguards","",""
"","balancing the requirements and interests of the Government with the rights of","",""
"","public officers, and the legal protection now provided by the law to public officers","",""
"","is contained in this Code. These procedures are therefore mandatory and cannot","",""
"","be superseded or disregarded without due legal authority.” [page 335]","",""
