"","undertaken ex abundanti cautela, or a precautionary measure in contemplation"
"","of a situation where title may have passed under the original deed."
"[32]","Nevertheless,  under  the  current  statutory  framework  discussed  above,  and"
"","given that the Deed of Revocation was admitted without objection at the close"
"","of the case, this Court must proceed on the basis that both deeds are formally"
"","admitted as evidence before the Court."
"[33]","Advancing on the foregoing discussion, I will now answer the questions of law"
"","as follows;"
