"516. Mr.  Dayaratne  presented  to  this  Court  excerpts  of  certain  speeches","","",""
"","made in Parliament by some Members of Parliament. Further excerpts of","",""
"","what was presented to this Court by Mr. Dayaratne appear below. They","",""
"","are  re-produced  in  this  Judgment  for  the  purpose  of  highlighting  the","",""
"","main  observations,  comments  and  concerns  expressed  by  the  relevant","",""
"Members  of  Parliament,  who","include","the  present  President  of","the"
"","Democratic  Socialist  Republic  of  Sri  Lanka  and  the  then  and  present","",""
"Leader of the Opposition.","","",""
