"bitten twice shy”. In contrast, the approach of the land-based management"
"of the vessel X-Press Pearl was to “ensure” the discharge of the leaking"
"container. One could argue that it could be taken as an effort to keep the"
"near explosive situation in Cargo Hold No. 2 restricted within the X-Press"
"Pearl group, and to  divert the attention  of the  Port  Control  by seeking"
"approval  for  the  discharge  of  the  leaking container  which  had  by  then"
"become an almost futile exercise in view of the situation which prevailed"
"on board the vessel at that point of time."
