"and socioeconomic activities of the country at large, after having taken"
"all the appropriate measures as mentioned above."
"Second Directive issued on 25/05/2021 (marked “6R10”):"
"(a) Take urgent action to control/extinguish fire on board to avert toxic air"
"emission."
"(b) Take all necessary actions in order to avert any potential chemical and"
"bunker oil spill/leakage in our waters."
"(c) Obtain the assistance of foreign experts, if it is evident that the capacity"
"of the local stakeholders is not sufficient to manage the situation."
"(d) Make necessary contingency arrangements to respond to any possible"
"chemical or oil spill."
"(e) If  the  situation  cannot  be  handled  in  the  current  location,  tow  it"
"towards the sea perpendicular to the land from the present location up"
"to 50 nautical miles."
"(f)  It is the advice of this authority to tow away the vessel away from Sri"
"Lanka waters, if the situation goes beyond out of control, which might"
"pose a severe threat to the environment, port operations, human health"
"and socioeconomic activities of the country at large, after having taken"
"all the appropriate measures as mentioned above."
