"foreign","jurisdictions,  London  and  Singapore","to  be  specific,"
"","pertaining to the X-Press Pearl disaster and its aftermath.",""
"Those orders were duly complied with. However, the progress made in","",""
"the  complaint  made  to  the  Commission  to  Investigate  Allegations  of","",""
"Bribery  or  Corruption","(CIABOC)  as  way  back 
in","the  year  2021"
"pertaining  to  the  matter  in  issue,  was  not  tendered.  Upon  the  Court","",""
"directly  requesting  the  said  information,  further  time  was  moved  by","",""
