"","billion should be charged and collected from the polluter (X-Press","","","",""
"","Pearl group of companies).","","","",""
"This  Court  is  of  the  opinion  that  an  order  in  the  nature  of  a  Writ  of","","","","",""
"Mandamus which has continuing effect (which may be referred to as a","","","","",""
"‘Continuing  Mandamus’),  should  be  issued,  by  way  of  establishing  a","","","","",""
"post-judgment  mechanism","(as","provided","hereinafter)","under","the"
"superintendency of this Court. This Court observes that the Petitioners","","","","",""
"have  also  prayed  for  the  establishment  of  such  a  mechanism  on  a","","","","",""
"direction of this Court.","","","","",""
