"433. In view of this overwhelming evidence confirming the nature and the","","","","","",""
"","extent of the resources used in the firefighting assistance rendered by the","","","","",""
"","Colombo Port Control, along with the support of the Sri Lanka Air Force,","","","","",""
"and","later  with","the  assistance  of","the  Indian  Coast  Guard,","it","is","the"
"","considered view of this Court that the contention “Port Control Authorities","","","","",""
"","are  guilty  of  gross  negligence  and  dereliction  of  duty,”  is  made  only  upon","","","","",""
"","highlighting  selected  items  of  evidence  that  gives  a  distorted  picture,","","","","",""
"","rather  than  on  a  reasonable  assessment  of  the  available  material,  in  its","","","","",""
"","totality and therefore is rejected as an unsubstantiated proposition.","","","","",""
