"648. Further, Section 84B(1) provides that “In the event of fire breaking out on"
"board any vessel in any specified port, the Harbour Master may proceed on board"
"the vessel with such assistance and persons as to him seem fit, and may give such"
"orders as seem to him necessary for scuttling the vessel or for removing the vessel"
"or any other vessel to such place as to him seems proper to prevent in either case"
"danger to other vessels and for the taking of any other measures that appear to"
"him expedient for the protection of life or property”."
