"environmental  and  navigational  conditions  such  as  prevailing  winds,","","","","","",""
"state of the sea, and traffic density. Provision 3.4.2 recognises the practical","","","","","",""
"difficulty of providing precise definitions but instructs Masters to report","","","","","",""
"incidents","involving","significant","structural  damage,","such","as","fires,"
"explosions,  groundings,  collisions,  or  equipment  failures  that  affect","","","","","",""
"critical navigation systems like steering gear or power supply.","","","","","",""
