"","4","SC/APPEAL/206/2014"
"the  2nd  and  3rd  quarters  of  2001,  and  the  1st  quarter  of  2002.  The","",""
"appellant was unsuccessful in the Court of Appeal, where they challenged","",""
"the calculation of the relevant excise duty by the Director of Excise Duty","",""
"Division of Sri Lanka Customs, the respondent. This appeal arises from","",""
"the  judgment  of  the  Court  of  Appeal  dated  07.08.2013.  As  crystallized","",""
"during the argument before this Court, the appeal centers on three main","",""
"issues:","",""
