"17","SC/APPEAL/206/2014"
"excise duty thereon had been detected by the respondent on or about",""
"10  October  2007.  Since  then,  despite  repeated  requests  by  the",""
"respondents,  the  petitioner  company  has  failed  to  disclose  any",""
"particulars relating to the issue of complimentary beer.",""
"In those circumstances, the respondents submit that the proviso to",""
"section 9(1) of the Act will apply, and therefore the applicable time",""
"period  for  the  recovery  of  such  excise  duty  is  ten  years  from  10",""
"October 2007.",""
