"41. Section 773 of the Code of Civil Procedure sets out that,"
"“
Upon hearing the appeal, it shall be competent to the Court of"
"Appeal  to  affirm,  reverse,  correct  or  modify  any  judgment,"
"decree, or order therein between and as regards the parties, or"
"to give such direction to the Court below, or to order a new trial"
"or  a  further  hearing  upon  such  terms  as  the  Court  of  Appeal"
"shall think fit, or, if need be, to receive and admit new evidence"
"additional to, or supplementary of, the evidence already taken"
"in the Court of first instance, touching the matters at issue in"
"any original cause, suit or action, as justice may require or to"
"order a new or further trial on the ground of discovery of fresh"
"evidence subsequent to the trial ”"
