"However, this was raised as an additional question of law.",""
"Section 614 of the Civil Procedure Code reads as follows:",""
"","614(1) In any action under this Chapter, whether it be instituted by"
"","a  husband  or  a  wife,  the  wife  may  present  a  petition  for  alimony"
"","pending the action. Such petition shall be preferred and dealt with"
"as  of  summary  procedure,  and","the  husband  shall  be  made"
"","respondent therein; and the court, on being satisfied of the truth of"
"","the  statements  therein  contained,  may  make  such  order  on  the"
