"in  Brandix  Apparel  Solutions  Limited  v.  Fernando","[S.C.  Appeal  60/2018,  S.C.M."
"05.05.2022], where I held that:",""
"","“It  should  be  noted  that  it  is  the  duty  of  an  employer  to  provide  a  safe  and"
"","supportive work environment for its employees. The productivity of the employee"
"","and  the  company  will  not  increase  unless  such  an  environment  exists.  Sexual"
"","harassment  in  any  form  should  be  dealt  with  severely  because  it  will  otherwise"
"pollute the working environment and affect employee morale.”",""
