"has abused his position.",""
"Section 24 of the Commissions of Inquiry Act reads as follows:",""
"Notwithstanding  anything","to  the  contrary  in  the  Code  of  Criminal"
"","Procedure Act, No. 15 of 1979  or any other law, it shall be lawful for"
"","the Attorney-General to institute criminal proceedings in a court of law"
"","in respect of any offence, based on material collected in the course of"
"","an investigation or inquiry or both an investigation and inquiry, as the"
"","case may be, by a Commission of Inquiry appointed under this Act."
