"purchased","items  of  old","jewelry  by  utilising  profits  made","from  a"
"smuggling  business  and  were  subsequently  converted  into  gold  slabs.","","",""
"The Attorney General, who preferred an appeal against the said finding","","",""
"of fact, contended before their Lordships that the said determination of","","",""
"fact  reached  by  Court  was  made  neither  on  a  perception  of  the  oral","","",""
"evidence  nor  was  it  reached  based  upon  credibility  or  demeanour  of","","",""
"witness, but was referable solely to inferences and assumptions. It is in","","",""
"these  circumstances  the  appellate  Court  had  made  the  pronouncement","","",""
