"","S.C. Appeal No. 14/2019","","","","","","","",""
"suffering","a","necessarily","fatal","cut","injuries","that","resulted","in","her"
"instantaneous  death,  then  the  2nd  accused,  and  the  Appellant  would","","","","","","","","",""
"most certainly have shared a common murderous intention with the 1st","","","","","","","","",""
"accused, who carried on the fatal attack and therefore have participated","","","","","","","","",""
"in","the  murder  by","","facilitating","the  1st  accused.  There  are  no  other","","","","",""
"circumstances that exist to point any other conclusion.","","","","","","","","",""
