"After  careful  consideration,  I  find  that  the  Applicant  has  not  provided  any  evidence","","","","","","",""
"before the Labour Tribunal therefore, the calculation and awarding 6 years’ salary as","","","","","","",""
"compensation  by","","the  President  of","","the  Labour  Tribunal","","is  arbitrary.  After  due",""
"consideration of the dictum pronounced by Justice Vythialingam in Ceylon Transport","","","","","","",""
"Board v A.H. Wijeratne (supra), I am in agreement with his Lordship, hence I decide","","","","","","",""
"to  award  compensation  equivalent  to  3  years’  salary  to  be  paid  to  the  Substituted","","","","","","",""
"Applicant.  While","affirming","the","findings  other","than","the","computation  of","the"
"compensation, of the President of the Labour Tribunal, I am hereby varying the order","","","","","","",""
