"1 Section 31B (3); Where an application under subsection (1) relates -"
"(a) to any  matter which, in  the opinion of the tribunal,  is similar to or identical  with a"
"matter constituting or included in an industrial dispute to which the employer to whom"
"that application relates is a party and into which an inquiry under this Act is held, or"
"(b) to any matter the facts affecting which are, in the opinion of the tribunal, facts affecting"
"any  proceedings  under  any  other  law,  the  tribunal  shall  make  order  suspending  its"
"proceedings  upon  that  application  until  the  conclusion  of  the  said  inquiry  or  the  said"
"proceedings under any other law, and upon such conclusion the tribunal shall resume the"
"proceedings  upon  that  application  and  shall  in  making  an  order  upon  that  application,"
"have regard to the award or decision in the said inquiry or the said proceedings under any"
"other law."
