"may arise whether any party aggrieved by a judgement, decree, or order made by any District"
"Court, etc. also has the option to select among such High Courts to lodge an appeal or revision"
"application."
"On the other hand, Section 2(1) of the High Court of the Provinces (Special Provisions) Act"
"No. 10 of 1996 provides that every High Court established by Article 154P of the Constitution"
"for a Province shall have exclusive jurisdiction and shall have cognizance of and full power"
"to hear and determine, in the manner provided for by written law, all actions, applications"
"and proceedings specified in the First Schedule (arising out of commercial transactions)  to"
"the said Act and the matters set out in its Second Schedule including the relevant proceedings"
"under the Companies Act and Intellectual Property Act. The High Court which exercises the"
"above jurisdiction is casually called the ‘Commercial High Court’. However, no reference to"
"the term ‘Commercial High Court’ or ‘Civil Appellate High Court’ has been made either in"
"the said Act No. 10 of 1996 and Act No. 19 of 1990 respectively."
"The said Act No. 10 of 1996, has made provisions to identify the territorial jurisdiction of the"
"High Court within the province based on (a) the place of residence; (b) the cause of action"
"arising; (c) the registered office of the respective Companies; and (d) the place of making the"
"contract sought to be enforced. Anyhow, where an Order under Section 2(1) of the said Act"
"No. 10 of 1996 is made by the Minister in respect of a High Court, the jurisdiction under the"
"said Section 2(1) shall be exercised by that High Court sitting in Colombo or any other place"
"as may be designated by the Minister by Order published in the Gazette with the concurrence"
"of the Chief Justice. Notwithstanding the provisions in the said Act No. 19 of 1990 and Act"
"No. 10 of 1996, no specific and detailed arrangements regarding territorial jurisdiction have"
"been made in Article 154P, although the Chief Justice is empowered under Article 154P (2)"
"to nominate several Judges as may be necessary to each High Court of the Province."
"The  contention  of  the  Respondent-Petitioner-Appellant  who  relies  on  the  judgement  of"
"Kaluthanthrige Dona Jayaseeli v. Kaluthanthirige Dona Dayawathi- SC Appeal No. 29/2016 SC"
"Minutes of 28.02.2019 is that the Labour Tribunal of Wattala falls within the Western Province"
"and as such the High Court of the Western Province (holden in Colombo) has jurisdiction to"
"hear  its  revision  applications.  The  Supreme  Court  in  the  said  judgement  of  Kaluthanthrige"
"Dona Jayaseeli   took the view that any High Court established in a Province, has jurisdiction"
