"362/2017, SCM 10.01.2018)].”",""
"13. This Court finds that, when the Petitioner filed the initial application dated",""
"","30/10/2015,  he  was  fully  aware  that  the  jurisdictional  requirement  under"
"","Article 126(2) of the Constitution had already been breached. By producing"
"P9,  the  Petitioner  sought  to  rely  on  the  statutory  exclusion","from  the"
"","computation of time under Section 13(1) of the Human Rights Commission"
"","Act,  thereby  placing  the  Respondents  on  notice  of  such  reliance.  This"
"","obviates the need for the Respondents to have raised a specific objection in"
"that regard.",""
