"the produce, facts in support of the Defendants-Respondents’ possession of the disputed"
"land was subordinate in character, devoid of any claim to ownership."
"In the said premise and in consideration of all the above circumstances, I answer the"
"Question of Law No. 4 also in the affirmative."
"In these reasons, the Judgement dated 22/11/2011 of the Civil Appeal High Court is"
"hereby set aside and the Judgement dated 22/01/2007 of the District Court of Chilaw is"
"affirmed. No order for Costs."
