"The fundamental conditions in which the maxim applies is aptly described by Erie C.J. in","","",""
"Scott v. London & St. Katherine Dock Co. [(1865) 3 H &C. 596 at 601] as follows:","","",""
"","“There must be reasonable evidence of negligence, but where the things is shown to","",""
"","be under the management of the defendant or his servants, and the accident is such","",""
"as","in  the  ordinary  course  of  things  does  not  happen","if","those  who  have  the"
"","management  use  proper  care,  it  affords  reasonable  evidence  in  the  absence  of","",""
"","explanation by the defendant, that the accident arose from want of care.”","",""
