"Janak De Silva, J"
"with about 1 ½ feet jutting out onto each side. Thus, the road was around 21 ½ feet wide"
"each way."
"In these circumstances, I have no hesitation in rejecting application of the maxim res ipsa"
"loquitur to the facts and circumstances of this case. The High Court of Civil Appeal appears"
"to have ventured on a speculative exercise in holding that this maxim applies to the facts"
"and  circumstances  of  this  action.  It  is  of  vital  importance  to  appreciate  the  difference"
"between an inference and conjecture or speculation in the application of this maxim. In"
"Caswell v. Powell Duffryn Associated Collieries [(1940) AC 152 at 169] Lord Wright"
"provides the following instructive exposition of the difference between an inference and"
"speculation or conjecture:"
