"case, the learned District Judge has allowed the Defendants to deposit a sum of money"
"equivalent  to  the  sum  speciﬁed  in  the  decree  nisi  or  to  furnish  a  security  which  is"
"reasonable and suﬃcient to sa(cid:415)sfy the sum men(cid:415)oned in the decree nisi, the reality is"
"that  the  learned  District  Judge  has not considered  whether that  requirement  could be"
"sa(cid:415)sﬁed by accep(cid:415)ng as security for the purposes of Sec(cid:415)on 6(2)(b) the same property"
"mortgaged to the Plain(cid:415)ﬀ at the (cid:415)me the credit facility was obtained. This becomes even"
"more signiﬁcant in view of the Plain(cid:415)ﬀ’s failure to explain in the plaint why it chose not to"
"proceed by way of parate execu(cid:415)on, although such a course of ac(cid:415)on was available to it."
