"Obeyesekere, J"
"T
he Plain(cid:415)ﬀ – Respondent – Respondent [the Plain(cid:415)ﬀ] is a bank duly incorporated in the"
"Republic of India, with a branch oﬃce in Sri Lanka. It is a licensed commercial bank within"
"the meaning of the Banking Act, No. 30 of 1988, as amended, and is a lending ins(cid:415)tu(cid:415)on"
"within  the  meaning  of  the  Debt  Recovery  (Special  Provisions)  Act,  No.  2  of  1990  [the"
"principal enactment], as amended by the Debt Recovery (Special Provisions) Amendment"
