"","25","SC/APPEAL/65/2025"
"Appellate  and  revisionary  jurisdiction  of  the  Provincial  High  Court","",""
"against judgments and orders of the District Court","",""
"By the High Court of the Provinces (Special Provinces) (Amendment) Act No.","",""
"54 of 2006, sections 5A, 5B and 5C were introduced to the Principal Act No.","",""
"19 of 1990. This was done to confer appellate and revisionary jurisdiction","",""
"to the Provincial High Courts against judgments and orders of the District","",""
"Courts of the relevant Provinces. These High Courts are commonly referred","",""
"to as High Courts of Civil Appeal.","",""
"In general, the procedure to be followed in the Provincial High Court of Civil","",""
"Appeal is the same as that followed in the Court of Appeal. Section 5A(2) of","",""
"Act No. 19 of 1990 provides that the provisions of sections 23 to 27 of the","",""
"Judicature Act No. 2 of 1978, sections 753 to 760 and sections 765 to 777","",""
"of the Civil Procedure Code, and any written law applicable to the exercise","",""
"of  jurisdiction  by  the  Court  of  Appeal,  shall  apply  to  the  Provincial  High","",""
"Court. Article 170 of the Constitution defines “written law” to mean  “any","",""
"law and subordinate legislation and includes statutes made by a Provincial","",""
"Council,  Orders,  Proclamations,  Rules,  By-laws  and  Regulations  made  or","",""
"issued by any body or person having power or authority under any law to","",""
"make or issue the same.” It is in this context that the Rules of the Court of","",""
"Appeal and the Rules of the Supreme Court (insofar as they are applicable","",""
"to  the  Court  of  Appeal),  made  by  the  Chief  Justice  together  with  three","",""
"Judges of the Supreme Court under Article 136 of the Constitution, apply","",""
"with equal force to proceedings before the Provincial High Courts  of Civil","",""
"Appeal.","",""
"After the said amendment by Act No. 54 of 2006, section 5A of the Principal","",""
"Act No.19 of 1990 reads as follows:","",""
