"","3","SC/APPEAL/65/2025"
"In the Court of Appeal, the defendant raised a preliminary objection to the","",""
"maintainability  of  the  said  application  on  the  ground  that  the  Court  of","",""
"Appeal  has  no  jurisdiction  to  entertain,  in  any  form—whether  by  way  of","",""
"appeal, revision, or restitutio in integrum—a challenge to a judgment of the","",""
"Provincial  High  Court  of  Civil  Appeal  pronounced  in  the  exercise  of  its","",""
"appellate jurisdiction, as such jurisdiction lies exclusively with the Supreme","",""
"Court.  By  order  dated  15.11.2022,  the  Court  of  Appeal  overruled  this","",""
"objection  and  fixed  a  date  for  the  defendant  to  file  objections  to  the","",""
"substantive application. This appeal, preferred by the defendant with leave","",""
"obtained, is from that order of the Court of Appeal, and leave was granted","",""
"by this Court on the same question of law.","",""
"Establishment of Provincial High Courts","",""
"According to Article 105 of the Constitution, in the judicial hierarchy, after","",""
"the Supreme Court of the Republic of Sri Lanka and the Court of Appeal of","",""
"the Republic of Sri Lanka, the Constitution recognises the High Court of the","",""
"Republic of Sri Lanka.","",""
"Article 111(1) of the Constitution, as originally stood, read as follows:","",""
