"amayawardhena, J."
"Introduction"
"Nearly  ten  years  after  the  decree  of  divorce  was  entered,  the  plaintiff"
"instituted this action in the District Court of Negombo against the defendant"
"seeking partition of a land in equal shares on the basis that the parties were"
"legally  divorced.  The  defendant  moved  for  dismissal  of  the  action  on  the"
"ground that the plaintiff was holding the half share of the land in trust for"
"the defendant. After trial, the District Court entered judgment in favour of"
"the plaintiff as prayed for. On appeal by the defendant, the Provincial High"
"Court  of  Civil  Appeal  of  Negombo  set  aside  the  judgment  of  the  District"
