"21","SC/APPEAL/65/2025"
"Provided further that the Supreme Court shall grant leave to appeal in",""
"every matter or proceeding in which it is satisfied that the question to",""
"be decided is of public or general importance; and",""
"(b) a final order, judgment or sentence of a High Court established by",""
"Article  154P  of  the  Constitution","in  the  exercise  of 
its 
jurisdiction"
"conferred  on  it  by  paragraph  (3)  (a),  or  (4)  of  Article  154P  of  the",""
"Constitution may appeal therefrom to the Court of Appeal.",""
