"","[Expulsion 01/ 2022] Page 32 of 62"
"ii.","The principles of natural justice did not apply to the expulsion of members, so as to"
"","afford them a right to be heard before expulsion, because there were circumstances"
"","sufficient  to  prevent  the  application  of  the  principles,  in  that  the  council  owed  the"
"","association a duty to exercise their powers bona fide in the interests of the association;"
"","this duty might require a power to be exercised at great speed (whereas natural justice"
"","might require delay); this in itself indicated that the council was intended to be able"
"","to exercise its powers unfettered by the principles of natural justice."
