"plaintiffs, until trial of the action, all rights of their membership.",""
"Megarry J in Gaiman’s case,  refusing to grant the prayed mandatory injunction, held in his",""
"judgment inter alia, the following points:",""
"i.","There were no grounds for the court to intervene to prevent an alleged abuse of power"
"","by the council since the power to deprive a member of his membership was a direct"
"","power and the evidence did not disclose that it had been exercised otherwise than in"
"","good faith and in what were believed to be the best interests of the association and"
"","members as a whole."
