"The  learned  Election  Judge  overruled  all  three  preliminary  objections.  The  Appellants","","","","","","","","",""
"appealed. Leave to appeal has been granted on the following questions of law:","","","","","","","","",""
"","(1) Whether the learned Election Judge erred in law by failing to recognise that the","","","","","","","",""
"","petition does not fulfil the ground set out in Section 82P(2) of the Ordinance?","","","","","","","",""
"","(2) Whether the Election Judge erred in law by failing to consider statutory provisions","","","","","","","",""
"","for recounting in terms of Section 63(7) and 63(8) of the Ordinance?","","","","","","","",""
"Question of Law No. 1","","","","","","","","",""
"The Petitioner has in his petition prayed for the following relief:","","","","","","","","",""
"","a)  Notice on the Respondents;","","","","","","","",""
"","b)  To direct the 7th and 8th Respondents to issue the election results and the","","","","","","","",""
"","postal vote results cast in Kahatagasdigiliya Pradeshiya Sabha Ward No.6 to","","","","","","","",""
"","the Petitioner-Respondent;","","","","","","","",""
"","c)  To direct the 7th and 8th Respondents to recount the election results and the","","","","","","","",""
"","postal vote results cast in Kahatagasdigiliya Pradeshiya Sabha Ward No.6;","","","","","","","",""
"","d)  To declare that the 1st Respondent-Respondent has not been duly elected to","","","","","","","",""
"","the Kahatagasdigiliya Pradeshiya Sabha after a recount of votes;","","","","","","","",""
"e)  To","declare","that","the","Petitioner-Respondent","is","duly","elected","to","the"
"","Kahatagasdigiliya Pradeshiya Sabha after a recount of votes;","","","","","","","",""
"f)  Costs;","","","","","","","","",""
"","g)  Such other relief as considered appropriate by Court.","","","","","","","",""
"The Appellants contend that the relief claimed by the Petitioner is not in conformity with","","","","","","","","",""
"Section 82(2) of the Ordinance. In particular, it is submitted that the relief sought by the","","","","","","","","",""
"Petitioner is not to have ‘the election in respect of any ward of an electoral area declared","","","","","","","","",""
"","","","","Page 6 of 17","","","","",""
