"the  Plaintiff-Respondent  namely  Sri  Lanka  Savings  Bank  Limited","(hereinafter"
"sometimes  referred  to  as  the  “Respondent  Bank”)  to  the  Appellants.  The  said",""
"Pramuka Bank, on 1st October 2007 was taken over by the Monetary board of Central",""
"Bank of Sri Lanka (CBSL) due to mismanagement and vested under the Respondent",""
"Bank, who is a fully state owned licensed specialized bank under the Banking Act No.",""
"30 of 1998, which inter alia provides financial facilities to its customers in its scope of",""
"business.",""
