"Convention against Torture and other Cruel, Inhuman or Degrading Treatment or"
"Punishment Act, No. 22 of 1994, against the 1st to 5th Respondents who are liable for"
"the   infringement   of   the   Petitioner’s   fundamental   rights   under  Article   11   of   the"
"Constitution."
"The Petitioner’s complaint is that he was subjected to torture, cruel, inhuman and"
"degrading treatment by the 1st  to 5th  Respondents using the colour of their office"
"whilst he was unlawfully arrested and detained in the Alawwa police station."
"Accordingly,   this   Court   granted   leave   to   proceed   on   the   alleged   violation   of   the"
"Petitioner’s  fundamental rights guaranteed under Article 11, 13(1) and 13(2) of the"
"Constitution.1"
