"Limited  [SC  CHC  Appeal  06/2003  decided  on  11.02.2016]  it  was","","","","","",""
"held that,","","","","","",""
"","“I  am  of  the  view  that  any  Court  is  entitled  to  look  into  the","","","","",""
"","surrounding  circumstances  in  order  to  identify  the  scope  and","","","","",""
"","object  of  the  guarantee  bonds  just  as  much  as  it  would  be","","","","",""
"entitled","to","look  at","the","factual  matrix  as  an  aid","to","the"
"","interpretation  of  any  other  commercial  agreement.  The  court","","","","",""
"","should always seek to construe the document in such a way as","","","","",""
"","to reflect what may fairly be inferred to have been the objective,","","","","",""
"","intention and understanding of the parties.”","","","","",""
