"this Court to the minute made by the 3rd Respondent on “3R4” to that effect. Thus, she"
"submitted that the 3rd Respondent had taken prompt action, and therefore the allegation"
"of the Petitioner against the 3rd Respondent that the latter was responsible for unlawful"
"inaction is ill-founded. She also submitted that while it may have been more appropriate"
"for the 3rd Respondent to have communicated to the Petitioner his decision, not having"
"done so was unintentional and only an ‘administrative lapse’."
