"16/07/2020, three additional questions of law were also permitted to be raised, in"
"response to concerns expressed by the parties that certain consequential questions"
"had  not  been  recorded.  These  additional  questions  were  duly  recorded  at  the"
"instance of Court, and it appears that this step was not taken before the same bench."
"In any event, having considered the totality of the pleadings and the evidence, and"
"in light of the view taken regarding the identification of the corpus, I find that in"
"deciding on the rest of the questions quoted earlier in this judgment need not be"
"considered and I answer the said questions accordingly."
