"42.","In D.M.S. Fernando and Another v. Mohideen Ismail,4
the majority opinion of
the"
"","five-judge bench,
led by Samarakoon, C.J., makes it clear that the notice of assessment,"
"","including the mandatory reasons, must be communicated to the taxpayer within the"
"","statutory deadline for
the assessment
to be valid. The internal act of preparing an"
"","assessment alone is insufficient to satisfy the legal requirement."
"43.","Samarakoon C.J. emphasized that the purpose of requiring reasons, was to ensure that"
"","the Assessor genuinely
applied their mind to the
taxpayer’s
return and reached a"
"","definite determination. His Lordship stated:"
