"Further, Article 44(3) of the Constitution requires that the position of the Minister in"
"charge of the subject of Defence be filled by the President. It is as follows:"
"(3) The President shall be the Minister in charge of the subject of"
"Defence and may exercise, perform and discharge the powers, duties and"
"f
unctions of any Minister of the Cabinet of Ministers or any Minister who is"
"not a member of the Cabinet of Ministers, subject to the provisions of the"
"Constitution, for not exceeding fourteen days during a period within which"
"any subject or function is not assigned to any such Minister under the"
"provisions of paragraph (1) of this Article or under paragraph (1) of Article"
"45 and accordingly, any reference in the Constitution or any written law to"
"t
he Minster to whom such subject or function is assigned, shall be read and"
"construed as a reference to the President:"
"Provided however, preceding provisions of this paragraph shall not"
"preclude the President from assigning any subject or function to himself in"
"consultation with the Prime Minister and accordingly, any reference in the"
"Constitution or any written law to the Minister to whom such subject or"
"f
unction is assigned, shall be read and construed as a reference to the"
