"into by an entity or person known to law?",""
"The main issues that need to be considered in this appeal are whether;",""
"(i)","the appellant had the capacity to enter into the said Sub-Contract produced marked as"
"","‘P2’,"
"(ii)","there was an agreement between the parties to enter into the said contract (meeting of"
"","minds), and"
"(iii)","the appellant is entitled in law to institute the action under reference in the Commercial"
"","High Court after the Arbitral Tribunal held that the sub-contract (‘P2’) is void ab initio."
